question,answer,category,difficulty
"The Berlin-based group Meydan TV published articles about corruption in this country’s military written by dissident Afgan Mukhtarli . This country began rebuilding the ghost town of Agdham after signing an agreement that created the “3+3 platform.” This country’s defense minister has praised the Israeli Aerostar and Harop drones that it has acquired en masse as “highly effective,” though it could not deploy them during the capture of  Shusha. This country’s forces halted their advance 9 miles outside of Stepanakert in 2020. Its Shah Deniz field is the  eastern end of the Southern Gas Corridor, a plan to cut European energy dependence on Russia. For 10 points, what majority-Muslim country disputes Nakhchivan  and Nagorno-Karabakh  with Armenia?",Azerbaijan ,Current Events,8
"A former cultural affairs minister apologized for allowing this organization to change its name in 2015. This organization announced “Think Tank 2022” to promote “seeds of peace” at its 2021 Rally of Hope, whose headline speaker was Mike Pence. In January 2023, a welfare ministry warned this organization to stop promoting unsanctioned adoptions. In September 2022, it acknowledged a major case of “excessive  donations,” which it commonly solicits as repayment for an occupation that lasted from 1910 to 1945. Tetsuya Yamagami said this organization destroyed his mother’s finances, motivating him to assassinate Shinzo Abe. A text called the Divine Principle explains the purpose of its “blessings,” or mass weddings. For 10 points, name this religious cult founded by Sun-Myung Moon.",Unification Church ,Current Events,8
"In 2022, Tony DeLuca won re-election to this state’s house, despite having died of leukemia in October. A 2022 Senate candidate in this state employed two field organizers whom he had pardoned while chair of this state’s Board of Pardons. An African-American frontrunner in this state’s 2022 Senate GOP primary fell to third, after photos showed her at the January 6th protests. Joanna McClinton became the first female Speaker of this state's House after Mark  Rozzi resigned; Rozzi had been a bi·partisan choice while control of this state’s House was flipped due to vacancies. A Senator from this state checked himself into Walter Reed for clinical depression treatment while recovering from a stroke suffered during his campaign. For 10 points, in which state's 2022 Senate election did Mehmet Oz lose to John Fetterman?",Commonwealth of Pennsylvania,Current Events,8
"A politician from this country who used the slogan “It’s my turn” was accused by political opponents of falsifying his age to be younger than 70. A politician in this country sued the makers of the documentary The Lion of Bourdillon. The winner of a recent election in this country had to win at least a quarter of the vote in at least 24 states, which was made harder by the presence of four major candidates including Rabiu Kwankwaso and members from the  Peoples Democratic Party and All Progressives Congress. The INEC was criticized by Atiku Abubakar and Peter Obi for improperly uploading results after an election in this country once led by Goodluck Jonathan. For 10 points, name this country whose president Bola Tinubu recently succeeded Muhammadu Buhari.",Nigeria ,Current Events,8
"A victory speech by this person displayed the book The Minimum You Need to Know to Not Be an Idiot by an informal advisor to him, a far-right pundit and astrologer based in Richmond, Virginia. Richard Lapper’s book about this politician attributes his political success to the three lobbies of bullets, the Bible, and beef. This person dedicated a vote to impeach an earlier holder of his highest office to the convicted torturer Carlos  Ustra. This former military officer has encouraged his sons Carlos, Eduardo, and Flavio to also enter politics. Despite being stabbed, this president defeated Fernando Haddad in 2018 to succeed the unpopular Michel Temer , who himself had been appointed to finish Dilma Rousseff’s term. For 10 points, name this former president of Brazil who was defeated by Lula in a 2022 election.",Jair Messias Bolsonaro,Current Events,8
"A representative from this state cited criticism for using the American flag in campaign messaging and being grouped with freshmen as a returning member in her decision to switch parties. In this state, Anderson Clayton became the youngest chair ever of a Democratic party shortly before Tricia Cotham switched both her party affiliation and her stance on abortion rights. In 2023, this state became the 40th to agree to expand Medicare with a deal by  Tim Moore and Phil Berger, years after it was demanded by William Barber’s Moral Mondays protests. Dale Folwell and Mark Walker are challenging this state’s lieutenant governor Mark Robinson for the right to likely face Josh Stein in its 2024 gubernatorial election. For 10 points, name this state governed by Roy Cooper from Raleigh.",North Carolina ,Current Events,8
"Residents of this city launched a hunger strike to prevent the relocation of the General Iron recycling plant to a neighborhood. A mayoral candidate from this city proposed a plan to tax all international phone calls and wire transfers to fund schools as part of his role in post-earthquake Haiti. A politician from this city nicknamed the ""Velvet Hammer"" was indicted for allegedly funneling payments from AT&T to political ally Michael McClain. John Catanzara, the president of this city's police union, warned there would be ""blood in the streets"" if a certain politician won an election. Michael Madigan is from this city, whose last mayor failed to make the runoff in her 2023 reelection bid. For 10 points name this city, where Paul Vallas lost the mayoral race to Brandon Johnson.",Chicago,Current Events,8
"In 2022, this country invested 2 billion dollars into the private equity firm Affinity Partners. This country is constructing the Trojena ski resort to host the 2029 Asian Winter Games. Several WWE superstars were trapped in this country in 2019 over a possible payment dispute after the Crown Jewel show. A company owned by this country will jointly form the tentatively named ""NewCo"" after agreeing to a merger of an organization led by Jay Monahan. This country's Vision 2030 program seeks to grow its sovereign wealth fund to two trillion dollars and diversify away from dependence on its state owned company Aramco. For 10 points, name this country whose sovereign wealth fund has bought Newcastle United and sponsored the LIV Golf tour as part of the economic goals of its Crown Prince Mohamad Bin Salman.",Saudi Arabia ,Current Events,8
"A 2023 profile in Variety about this man claimed he evaded discipline by alluding to a lawsuit he had won against Tower Records in 2001. This man came out as gay in his 2011 memoir Transparent in which he also described being molested as a child. This anchor was taken off a show for sending threatening texts to co-host Kyra Phillips after she got a field assignment in Iraq. This anchor allegedly suggested Soledad O'Brien wasn't actually Black after she was given the job of hosting a docuseries over him. This anchor accused one co-host of interrupting him too much in one incident while another co-host checked her phone while he had a debate with Vivek Ramaswamy about the second amendment. This anchor apologized for claiming that Nikki Haley ""isn't in her prime."" For 10 points, name this former CNN host who was fired in April, 2022.",Don Lemon,Current Events,8
"Despite this country's 2007 General Law for Women's Access to a Life Free of Violence, a 125% increase in femicides led to the 2020 ""Day Without Us"" demonstration in its capital. In May 2023, it was revealed that this country had spied on its own under secretary of human rights using Pegasus. That official, Alejandro Encianas, was investigating the 2014 disappearance of 43 students from this country's Ayotzinapa  Rural Teachers College. In March 2023 migrants detained in this country lit mattresses on fire in protest resulting in a blaze that killed 38. This country granted asylum to Evo Morales in 2021. Street violence broke out in this country in early 2023 after the arrest of Ovidio ""the Mouse"" Guzman, the current head of the Sinaloa Cartel. For 10 points, El Chapo is from this country that is currently led by Andres Manuel Lopez Obrador.",Mexico ,Current Events,8
"This man used connections made from serving on the Attali Commission to facilitate Nestle's 2012 acquisition of a Pfizer division. Anne Fulda said that this man ""was never a kid like the others"" in a biography whose subtitle calls him ""A Perfect Young Man."" In 2021, this man's government announced a ban on flights between cities less than two and a half hours apart. A recent policy enacted by this man has resulted in ""saucepan"" protests. After serving under his predecessor as Minister of Economics this man founded the Renaissance party. This man used Article 49 of his country's constitution to avoid a vote on a reform which raised the retirement age to 64. In 2022, this man became the first president of his country to win reelection since 2002, beating out Jean-Luc Mélenchon and Marine Le Pen. For 10 points, name this current President of France.",Emmanuel Macron ,Current Events,8
"A former Vice President of IT Operations at this company, Michael Kail, was sentenced to 30 months in a bribery scandal. In late 2018, this company was forced to replace references to the 2013 Lac-Mégantic rail disaster in two of its works. This company is facing a class action lawsuit from Russian subscribers after refusing to comply with a Roskomnadzor  directive. In 2023, this company's co-founder stepped down and was replaced by Greg Peters and Ted Sarandos. A project started by one of this company's founders was spun off into Roku. In May, this company began its U.S. crackdown on password sharing, months after launching a new ad tier for $6.99 a month. For 10 points, name this media company founded by Reed Hastings and Marc Randolph that has released shows including Bridgerton and Stranger Things.",Netflix Inc.,Current Events,8
"A former prime minister of this country was accused by a University of Illinois professor on AᐧRᐧY News of torture. That former prime minister dissolved the assembly of this country’s largest state in January 2023 after a Movement for Justice win. A polio vaccination campaign for 44 million children is part of this country’s attempts to secure IᐧMᐧF loans for a 2022 disaster that damaged locations like the N-34  Highway. At COP 27, representatives from this country proposed loss and damage reparations from climate change after October 2022 floods killed over seventeen hundred people. In April 2022, a no-confidence vote coordinated by the PᐧDᐧM in this country ousted a former professional cricket player from leadership. For 10 points, name this country where Shehbaz Sharif succeeded Imran Khan as prime minister in Islamabad.",Islamic Republic of Pakistan,Current Events,7
"People employed as part of this policy are nicknamed “Big Whites” in reference to Big Hero 6. Announcements of this policy were juxtaposed with distressing audio recordings in a widely shared video montage titled The Sounds of April. Users received a red, amber or green QR code through a defunct mobile app developed as part of this policy by Ant Financial. The official English translation of this policy is  “dynamic clearance.” A November 2022 fire in a supposedly locked apartment building spurred protesters against this policy, who often hold up blank sheets of A4 printer paper. As part of this policy, athletes entered a “closed-loop management system” for the 2022 Winter Olympics. For 10 points, citywide lockdowns have been a hallmark of what policy recently eased by the CCP?","China’s zero-Covid policy ",Current Events,7
"This politician’s infrastructure-heavy first term was called the “fix the damn roads” initiative. This politician’s opponent in a 2022 election was outraised 28 to 1 and ran with Shane Hernandez. The response to Donald Trump’s 2020 State of the Union address was given by this politician, whose COVID-19 lockdowns were targeted by Operation Gridlock. The National Education Association and American Federation of Teachers donated over $2.25 million in support of this politician against the  DeVos family’s MAGA Inc. This politician won a 2022 gubernatorial election over Tudor Dixon. In December 2022, fourteen members of the Wolverine Watchmen militia were sentenced for targeting this governor in a 2020 kidnapping plot. For 10 points, name this progressive Democrat governor of Michigan nicknamed “Big Gretch.”",Gretchen Whitmer,Current Events,7
"A 2020 paper by Samantha Bailey and Chris Ryan called securities based on these things “the next Big Short” because of a previously long-standing prohibition on a type of discharge. The 2003 HEROES Act is being used to defend policy towards these things challenged by an injunction over the management of FEELP. Examples of these things named for Carl Perkins and Robert  Stafford were eclipsed in the earlier 2010s in favor of Treasury department products like PLUS. SLABS are securities based on these things, which trail mortgages as the second largest source of consumer debt. IDRs pay for these things from Nelnet and Sallie Mae. In August 2022, Joe Biden announced a plan for Pell Grants and $10,000 in forgiveness towards, for 10 points, what form of financial aid for education?",student loans ,Current Events,7
"Moderator note for players: Description acceptable. Geoffrey Fowler and Ed Markey proved that a claim made about this product was false, leading Markey to state that Congress would take action if not addressed. Doja Cat commented that owning this product ""means there's a higher chance that you're a complete loser"", although Nassim Nicholas Taleb suggested that people who didn't own this product were ""misers"". One person used this product to popularise a recipe involving a cookie  stuffed with Greek salad, while another caused Eli Lilly to lose $15 billion in market capitalisation. Against his wishes, Stephen King was gifted this product by the manufacturing company's owner, who had previously told King the price of this product would be reduced to $7.99 per month. For 10 points, what much-derided subscription service is offered by X, formerly Twitter, and adds a fetching checkmark to your name?","X Premium ",Current Events,7
"The psychologist Lee Cronbach used this word to name a method for determining how reliable educational tests could be – the same word follows Street Fighter in the name of the game where Charlie, Rose and Dan debuted. In 2020, a politician with this forename won a third term as President of their nation despite the constitution only allowing a two-term limit, and this name is the second word of the name of the Jaeger piloted by  Sasha and Aleksis Kaidonovsky in Pacific Rim. Jesse Singal credits the popularisation of this adjective to Neil Strauss’ 2005 book on pickup artistry, The Game, and this name is also used for a composite boson made from two protons and two neutrons. For 10 points, what is the first letter of the Greek alphabet?","Alpha ",Current Events,7
"The Kirk of St. Nicholas in Aberdeen holds a Book of Remembrance honouring the 167 who died during one of these events. The largest accidental example of this event was nicknamed the Lakeview Gusher, which began in March 1910 and was not controlled until September the following year. Activist David Bellamy came to nationwide attention after his work as a consultant on one of these events, which occurred when the Torrey Canyon ran aground in the Scilly Isles. The ""we're sorry"" PR campaign launched by Tony Hayward after one of these events was lampooned in a 2010 South Park episode, which aired shortly after Hayward stepped down as CEO of BP. For 10 points, Deepwater Horizon and Torrey Canyon are examples of what type of environmental disaster?",Oil spills ,Current Events,7
"This politician gave the May 2023 commencement speech to the NYU graduating class, where they received a degree alongside Misty Copeland. This politician’s popularity was boosted after 700 postal workers from the Posti Group went on strike in November 2019. Critics of this politician said they lied about getting a bill passed in order to gain indigenous votes, which this politician then blamed on stalling from the Centre Party. This politician courted controversy when a photo emerged of two women  kissing in their Keresanta house in July 2022. This leader of the SDP was briefly the youngest head of state and lost in an April 2023 election to the NCP led by Petteri Orpo, the same month her country became a member of NATO. For 10 points, name this most recent Prime Minister of Finland.",Sanna Marin,Current Events,7
"This country’s 1997 constitution became the second ever constitution after South Africa’s to prohibit discrimination based on sexual orientation. Because this country was embroiled by internal strife, foreign nationals were evacuated from it in Operation Morris Dance. A dictator of this country who came to power in a 1987 coup was nicknamed  “Colonel Steve Rambo.” A former president of this country who is currently serving life in prison for his role in a 2000 coup is George Speight. Close to 40% of this country’s populace are of Indian descent, which they trace back to when Girmityas were brought to work on sugar plantations on Vanua Levu. For 10 points, name this Melanesian country whose economy is powered by the bottled water industry, was once led by Frank Bainimarama, and has its capital at Suva.",Republic of Fiji,Current Events,7
"This politician’s son was forced to pay damages to Stav Shaffir, a opposition member who led a motion against this politician’s bid for immunity. This politician’s role as Minister of  Communications is being investigated alongside the telecommunications company Bezeq. This politician’s brother Yonatan was the only casualty on his country’s side during the  Entebbe Raid. A series of reforms were announced after this politician’s coalition defeated the rotational government of Yair Lapid and Naftali Bennett. This Chairman of the Likud party has made recent attempts to limit the power of his country’s Supreme Court, which may be tied to attempts to annex Palestinian territory. For 10 points, name this Prime Minister of Israel who is referred to by the nickname “Bibi.”",Benjamin Netanyahu ,Current Events,7
